author,description,price,publisher,title
박근혜,박근혜 전 대통령의 회고,"13,500원",가로세로연구소,그리움은 아무에게나 생기지 않습니다
이나은,드라마 속 설렘 그대로 담은 대본집 ,"16,650원",김영사,그 해 우리는 2
이나은,드라마 속 설렘 그대로 담은 대본집 ,"16,650원",김영사,그 해 우리는 1
김호연,힘들게 살아낸 오늘을 위로하는 편의점의 밤,"12,600원",나무옆의자,불편한 편의점
최태성,2022년에도 압도적 1위!,"13,500원",이투스북 ,"2022 큰별쌤 최태성의 별별한국사 한국사능력검정시험 심화(1, 2, 3급) 상"
장영하,장영하 변호사의 증언 ,"13,500원",지우LNB(지우출판),"굿바이, 이재명"
최태성,2022년도 한능검 합격 보장!,"13,050원",이투스북 ,"2022 큰별쌤 최태성의 별별한국사 한국사능력검정시험 심화(1, 2, 3급) 하"
설민석,"고려 왕건, 새로운 세상을 열다! ","10,800원",스토리박스,설민석의 한국사 대모험 19
최태성,500문제로 한능검 준비 끝!,"17,550원",이투스북 ,2022 큰별쌤 최태성의 별별한국사 기출 500제 한국사능력검정시험 심화
백희나,백희나 작가가 전하는 희망의 메시지! ,"16,200원",책읽는곰,연이와 버들도령
ETS,정기시험 기출문제로 목표점수 적중,"16,020원",YBM(와이비엠),ETS 토익 정기시험 기출문제집 1000 Vol.3 READING 리딩 
이혜원,"2022, 반전의 시작을 알리는 변화의 징후를 포착하라!","16,200원",서울대학교 생활과학연구소 소비트렌드분석센터,트렌드 코리아 2022
리사 손,늘 불안한 완벽주의 부모들에게,"16,200원",21세기북스,임포스터
데이비드 조,2020 최신판으로 토익 기출 보카 업그레이드,"11,610원",해커스어학연구소,해커스 토익 기출 보카
ETS,단독 토익 기출문제로 실전 대비 ,"16,020원",YBM(와이비엠),ETS 토익 정기시험 기출문제집 1000 Vol.3 LISTENING 리스닝  
김종원,매일 한 뼘씩 아이 마음이 자라는 인생 문장,"14,400원",소소하이,하루 한 장 365 인문학 달력
황현필,조회수 1억뷰의 명강의를 책으로 만나다!,"19,800원",역바연,이순신의 바다 
매트 헤이그,"삶과 죽음 사이, 마법의 도서관이 열린다","14,220원",노진선,미드나잇 라이브러리
켈리 최,바라던 삶에 가까워져라!,"14,400원",다산북스,웰씽킹 WEALTHINKING
유시민,전면개정 유시민의 세계사 거꾸로 읽기,"15,750원",돌베개,거꾸로 읽는 세계사
피트 데이비스,"무한 탐색의 시대 필요한 힘, 전념","16,020원",신유희,전념
앙드레 코스톨라니,돈에 대해 생각하는 기술,"10,800원",미래의창,"돈, 뜨겁게 사랑하고 차갑게 다루어라"
최종엽,갈 길을 잃었을 때 『논어』를 보라,"14,400원",유노북스,오십에 읽는 논어
오은영,국민멘토 오은영 박사의 나를 찾는 수업,"14,400원",코리아닷컴(Korea.com),오은영의 화해
로버트 기요사키,전 세계에서 가장 많이 팔린 경제경영서,"14,220원",안진환,부자 아빠 가난한 아빠 20주년 특별 기념판
앵거스 플레처,문학은 어떻게 우리의 정신을 고양시켜왔나,"24,120원",박미경,우리는 지금 문학이 필요하다
정영욱,"오늘도 잘 견뎌낸 나에게, 정영욱 작가가 건네는 위로 ","13,500원",부크럼,잘했고 잘하고 있고 잘 될 것이다
배진한,5가지 성공 투자 원칙 ,"15,750원",이레미디어,투자를 잘한다는 것 
이미예,"힐링 판타지 〈달러구트 꿈 백화점〉, 두 번째 이야기","12,420원",팩토리나인,달러구트 꿈 백화점 2
이치조 미사키,매일 기억을 잃는 너와 두 번 다시 돌아갈 수 없는 사랑을,"12,600원",권영주,"오늘 밤, 세계에서 이 사랑이 사라진다 해도"
이미예,"잠들면 열리는 비밀상점, 그곳에서 펼쳐지는 힐링 판타지","12,420원",팩토리나인,달러구트 꿈 백화점
강미강,"이준호, 이세영 주연 드라마 〈옷소매 붉은 끝동〉 원작","10,800원",청어람,옷소매 붉은 끝동 1
스콧 맥러플린,넥스트 빅 씽 Next Big Thing : NFT 시대가 온다,"16,200원",롤프 회퍼,NFT 레볼루션
흔한남매,웃음 폭탄 `에피소드`와 깨알 재미 `놀이`의 조합,"12,150원",백난도,흔한남매 9
강미강,"이준호, 이세영 주연 드라마 〈옷소매 붉은 끝동〉 원작","9,900원",청어람,옷소매 붉은 끝동 2
김지수,삶에 관한 이어령과 김지수의 대화 ,"14,850원",이어령,이어령의 마지막 수업
아이다이로,저주받은 빨간 집에 하나코와 닮은 어린 아이가? ,"5,400원",장혜영,지박소년 하나코 군 16 (특장판)
오은영,국민 육아멘토 오은영 박사의 현실밀착 육아회화,"15,750원",차상미,어떻게 말해줘야 할까
나태주,나태주 시인의 산문 X BTS 가사 ,"15,300원",열림원,작은 것들을 위한 시
아오야마 고쇼,드디어 100권! 검은 조직의 실마리가 밝혀지고,"4,950원",서울미디어코믹스(서울문화사),명탐정 코난 100 
